[
  {
    "project_name": "NASA - Spacia",
    "short_desc": "End-to-End MERN Stack Application Integrated with Live NASA Telemetry",
    "full_desc": "Built a production-ready, full-stack application that seamlessly consumes and visualizes live NASA API data. Engineered a secure Express backend deployed on Heroku and a highly responsive, unit-tested React frontend on Netlify, demonstrating full-lifecycle development and reliable third-party API integration.",
    "tags": {
      "icon": [
        { "name": "React", "iconName": "IconReact" },
        { "name": "Express", "iconName": "IconExpress" },
        { "name": "Netlify", "iconName": "IconNetlify" },
        { "name": "Heroku", "iconName": "IconHeroku" }
      ],
      "noIcon": []
    },
    "urls": [
      {
        "label": "GitHub",
        "url": "https://github.com/nxdun/NASA-Spacia",
        "description": "View Source Code",
        "iconName": "IconGitHub"
      }
    ],
    "time_period": "April 2024 - May 2024",
    "photos": [
      "https://raw.githubusercontent.com/nxdun/BlaBla/main/port-spacia-1.jpg",
      "https://raw.githubusercontent.com/nxdun/BlaBla/main/port-spacia-1.jpg"
    ],
    "slug": "nasa-spacia"
  },
  {
    "project_name": "Study-Forge Learning System",
    "short_desc": "Distributed E-Learning Platform Built on Kubernetes Microservices",
    "full_desc": "Architected a highly scalable, fault-tolerant learning management system using a polyglot microservices architecture (Spring Boot, Flask, Express). Containerized 7 distinct services using Docker and orchestrated them on Google Kubernetes Engine (GKE) to ensure zero-downtime scaling and high availability for enterprise-level user traffic.",
    "tags": {
      "icon": [
        { "name": "React", "iconName": "IconReact" },
        { "name": "Express", "iconName": "IconExpress" },
        { "name": "Flask", "iconName": "IconFlask" },
        { "name": "Spring Boot", "iconName": "IconSpringBoot" },
        { "name": "Docker", "iconName": "IconDocker" },
        { "name": "Kubernetes", "iconName": "IconKubernetes" }
      ],
      "noIcon": []
    },
    "urls": [
      {
        "label": "GitHub",
        "url": "https://github.com/nxdun/lms-microservice",
        "description": "View Source Code",
        "iconName": "IconGitHub"
      },
      {
        "label": "Live Frontend",
        "url": "https://lms-core-microservice.vercel.app/",
        "description": "Visit Live Website",
        "iconName": "IconGlobe"
      },
      {
        "label": "Demo Video",
        "url": "https://www.youtube.com/watch?v=y88QLlOEGJ0",
        "description": "Watch Demo Video",
        "iconName": "IconYoutube"
      }
    ],
    "time_period": "March 2024 - May 2024",
    "photos": [
      "https://raw.githubusercontent.com/nxdun/BlaBla/main/port-studyforge-1.png",
      "https://raw.githubusercontent.com/nxdun/BlaBla/main/port-studyforge-2.png"
    ],
    "featured": 50,
    "slug": "study-forge"
  },
  {
    "project_name": "Chatte - P2P and Global Messenger",
    "short_desc": "Low-Latency P2P Global Messenger with OSGi Architecture",
    "full_desc": "Engineered a secure, low-latency peer-to-peer messaging system utilizing Java socket programming and Apache Felix. Designed a modular OSGi client-server architecture to ensure high maintainability and robust user authentication protocols for secure data transmission.",
    "tags": {
      "icon": [
        { "name": "Java", "iconName": "IconJava" },
        { "name": "Apache Felix", "iconName": "IconApacheFelix" },
        { "name": "Eclipse IDE", "iconName": "IconEclipse" }
      ],
      "noIcon": ["Socket Programming"]
    },
    "urls": [
      {
        "label": "GitHub",
        "url": "https://github.com/nxdun/OSGI.chatte",
        "description": "View Source Code",
        "iconName": "IconGitHub"
      }
    ],
    "time_period": "February 2024 - March 2024",
    "photos": [
      "https://raw.githubusercontent.com/nxdun/BlaBla/main/port-osgi-1.jpg",
      "https://raw.githubusercontent.com/nxdun/BlaBla/main/port-osgi-2.jpg"
    ],
    "slug": "chatte-p2p"
  },
  {
    "project_name": "Movie Theatre Management System",
    "short_desc": "Scalable Movie Theatre Management Platform & REST API",
    "full_desc": "Directed the end-to-end development of a theatre management platform. Designed high-conversion UI/UX in Figma, architected a NoSQL MongoDB database, and built highly responsive React interfaces connected via secure RESTful APIs to deliver a seamless, crash-free booking experience.",
    "tags": {
      "icon": [
        { "name": "React", "iconName": "IconReact" },
        { "name": "MongoDB", "iconName": "IconMongodb" },
        { "name": "Figma", "iconName": "IconFigma" }
      ],
      "noIcon": ["RESTful API"]
    },
    "urls": [
      {
        "label": "GitHub",
        "url": "https://github.com/nxdun/Movie-theatre-management-system",
        "description": "View Source Code",
        "iconName": "IconGitHub"
      }
    ],
    "time_period": "July 2023 - October 2023",
    "photos": [
      "https://raw.githubusercontent.com/nxdun/BlaBla/main/port-mov-2.bak.jpg",
      "https://raw.githubusercontent.com/nxdun/BlaBla/main/port-mov-1.bak.jpg"
    ],
    "slug": "movie-theatre-management-system"
  },
  {
    "project_name": "Garment And Textile Management System",
    "short_desc": "Enterprise Resource Planning (ERP) System for Textile Management",
    "full_desc": "Developed a robust backend management system to digitize and streamline textile manufacturing workflows. Implemented MVC design patterns using JSP Servlets and SQL to ensure strict data integrity and scalable architecture, providing business owners with reliable, real-time inventory control.",
    "tags": {
      "icon": [
        { "name": "JSP Servlets", "iconName": "IconJava" },
        { "name": "SQL", "iconName": "IconSql" },
        { "name": "PHP", "iconName": "IconPhp" },
        { "name": "Apache Tomcat", "iconName": "IconTomcat" }
      ],
      "noIcon": []
    },
    "urls": [
      {
        "label": "GitHub",
        "url": "https://github.com/nxdun",
        "description": "View Source Code",
        "iconName": "IconGitHub"
      }
    ],
    "time_period": "January 2023 - March 2023",
    "photos": [
      "https://raw.githubusercontent.com/nxdun/BlaBla/main/port-hms-1.png",
      "https://raw.githubusercontent.com/nxdun/BlaBla/main/port-hms-1.png"
    ],
    "slug": "garment-and-textile-management-system"
  },
  {
    "project_name": "Smart Healthcare System for Urban Hospitals",
    "short_desc": "High-Availability Healthcare Management System (MERN Stack)",
    "full_desc": "Architected a secure, high-performance healthcare management platform tailored for high-traffic urban hospitals. Leveraged advanced structural design patterns (Singleton, Factory, Strategy) and rigorous unit testing to guarantee system reliability and safeguard sensitive patient data across a scalable MVC architecture.",
    "tags": {
      "icon": [
        { "name": "Express", "iconName": "IconExpress" },
        { "name": "Redux", "iconName": "IconRedux" },
        { "name": "MongoDB", "iconName": "IconMongodb" },
        { "name": "React", "iconName": "IconReact" },
        { "name": "Tailwind", "iconName": "IconTailwind" },
        { "name": "CSS", "iconName": "IconCss" },
        { "name": "ThreeJS", "iconName": "IconThreejs" }
      ],
      "noIcon": [
        "JWT",
        "Higher Order Components",
        "Advanced File Organization",
        "Event Emitter",
        "IIFE",
        "Discriminators"
      ]
    },
    "urls": [
      {
        "label": "GitHub",
        "url": "https://github.com/nxdun/HealthWizard",
        "description": "View Source Code",
        "iconName": "IconGitHub"
      }
    ],
    "time_period": "April 2024 - July 2024",
    "photos": [
      "https://ik.imagekit.io/cq1p7u6vo/HealthWizard/Admin-userDashboiard.jpeg?updatedAt=1729425370011",
      "https://ik.imagekit.io/cq1p7u6vo/HealthWizard/appointment%20booking.jpg?updatedAt=1729425369292",
      "https://ik.imagekit.io/cq1p7u6vo/HealthWizard/Screenshot_20-10-2024_17224_localhost.jpeg?updatedAt=1729425369488",
      "https://ik.imagekit.io/cq1p7u6vo/HealthWizard/Admin%20Configuration%20Management.jpeg?updatedAt=1729425369398"
    ],
    "slug": "smart-healthcare-system-for-urban-hospitals"
  },
  {
    "project_name": "Health Wizard Security & Operations Layer",
    "short_desc": "Agile Healthcare Dashboard with Advanced Security Protocols",
    "full_desc": "Delivered a secure hospital operations dashboard utilizing Agile and Extreme Programming (XP) methodologies. Implemented JWT authentication and advanced MongoDB discriminators to ensure strict data governance and rapid feature delivery aligned with complex clinical requirements.",
    "tags": {
      "icon": [
        { "name": "Express", "iconName": "IconExpress" },
        { "name": "Redux", "iconName": "IconRedux" },
        { "name": "MongoDB", "iconName": "IconMongodb" },
        { "name": "React", "iconName": "IconReact" }
      ],
      "noIcon": []
    },
    "urls": [
      {
        "label": "GitHub",
        "url": "https://github.com/nxdun/HealthWizard",
        "description": "View Source Code",
        "iconName": "IconGitHub"
      }
    ],
    "time_period": "April 2024 - July 2024",
    "photos": [
      "https://ik.imagekit.io/cq1p7u6vo/HealthWizard/appointment%20booking.jpg?updatedAt=1729425369292",
      "https://ik.imagekit.io/cq1p7u6vo/HealthWizard/Admin%20Configuration%20Management.jpeg?updatedAt=1729425369398"
    ],
    "slug": "health-wizard"
  },
  {
    "project_name": "CodeWizard - Microservice Based Project",
    "short_desc": "Automated Code Analysis & SaaS Project Management Suite",